Texto Original,Texto Expandido,Classe,Categoria
Desenvolvimento de criptomoedas e blockchain: inovação financeira brasileira,"O Brasil emerge como um polo de inovação no mercado de criptomoedas e blockchain, atraindo investidores e empreendedores tecnológicos. A transformação financeira digital permite novos modelos de transações e investimentos descentralizados. Startups brasileiras estão desenvolvendo soluções inovadoras que podem revolucionar o sistema financeiro tradicional. O ecossistema de criptoativos no país cresce exponencialmente, demonstrando maturidade e potencial econômico.",0,Economia
"Economia colaborativa: plataformas que revolucionam setores de transporte, hospedagem e serviços","Plataformas de economia colaborativa estão redesenhando os modelos tradicionais de consumo e prestação de serviços no Brasil. Empresas como Uber, Airbnb e GetNinjas transformam a forma como pessoas e empresas interagem economicamente. A digitalização permite maior eficiência, redução de custos e democratização do acesso a serviços. Essas plataformas não apenas geram novos modelos de negócios, mas também criam oportunidades de renda para milhares de brasileiros. A inovação colaborativa representa uma mudança estrutural na economia nacional.",0,Economia
Economia criativa no audiovisual: potencial de crescimento da produção brasileira de séries e filmes,"O setor audiovisual brasileiro apresenta crescimento significativo, com séries e filmes conquistando mercados internacionais. Plataformas de streaming ampliam a visibilidade da produção nacional, gerando novas oportunidades econômicas. A diversidade cultural brasileira se torna um diferencial competitivo na produção de conteúdo. Investimentos em tecnologia e narrativas originais fortalecem a economia criativa do país. O audiovisual brasileiro se consolida como importante vetor de exportação cultural e geração de valor econômico.",0,Economia
Economia do conhecimento: investimentos em educação profissional e tecnológica,"A economia do conhecimento se torna estratégica para o desenvolvimento brasileiro, com investimentos crescentes em educação profissional e tecnológica. Universidades e institutos técnicos são fundamentais para formar profissionais alinhados com as demandas do mercado global. A capacitação em tecnologias emergentes como inteligência artificial, blockchain e análise de dados se torna diferencial competitivo. O investimento em capital humano qualificado é essencial para impulsionar a inovação e a produtividade nacional. A educação se configura como principal motor de transformação econômica e social.",0,Economia
Indústria 4.0 no Brasil: transformação digital e automação na manufatura brasileira,"A Indústria 4.0 representa uma revolução tecnológica na manufatura brasileira, integrando automação, internet das coisas e inteligência artificial. Empresas investem em tecnologias que aumentam a eficiência, reduzem custos e melhoram a competitividade global. A transformação digital permite maior flexibilidade, personalização e velocidade nos processos produtivos. Setores como automotivo, aeroespacial e eletrônico lideram essa transformação. O Brasil busca se posicionar como protagonista na quarta revolução industrial, modernizando sua base manufatureira.",0,Economia
Investimentos em infraestrutura verde: oportunidades econômicas na transição para uma economia sustentável,"A infraestrutura verde surge como estratégia fundamental para o desenvolvimento econômico sustentável do Brasil. Investimentos em projetos de baixo carbono e tecnologias limpas atraem capital internacional e promovem inovação. Setores como energia renovável, construção sustentável e mobilidade verde ganham protagonismo na economia nacional. A transição ecológica representa não apenas uma necessidade ambiental, mas uma oportunidade de geração de empregos e desenvolvimento tecnológico. O Brasil possui condições únicas para se tornar líder mundial em economia verde.",0,Economia
Mercado de carbono e créditos ambientais: novas fronteiras econômicas sustentáveis,"O mercado de carbono emerge como importante instrumento econômico para mitigação das mudanças climáticas. Empresas brasileiras começam a monetizar suas reduções de emissões através de certificados de crédito de carbono. A floresta amazônica se torna ativo estratégico nessa nova economia, valorizando a preservação ambiental. Startups e corporações desenvolvem soluções inovadoras para mensuração e comercialização de créditos ambientais. Esse mercado representa uma convergência entre sustentabilidade e oportunidades econômicas.",0,Economia
Microempreendedorismo digital: como pequenos negócios estão conquistando espaço na economia nacional,"O microempreendedorismo digital revoluciona o cenário econômico brasileiro, democratizando o acesso ao mercado. Plataformas online, redes sociais e marketplaces permitem que pequenos negócios alcancem consumidores globalmente. Microempreendedores utilizam tecnologia para reduzir custos, personalizar serviços e criar estratégias de negócio inovadoras. A digitalização facilita a formalização e o crescimento de negócios de pequeno porte. Essa transformação representa uma importante estratégia de inclusão econômica e geração de renda.",0,Economia
Setores emergentes de tecnologia da informação: exportação de talentos e serviços de TI,O setor de tecnologia da informação brasileiro se destaca pela exportação de talentos e serviços especializados. Profissionais brasileiros de TI são reconhecidos globalmente por sua alta qualificação e criatividade. Centros de desenvolvimento de software em cidades como São Paulo e Florianópolis atraem investimentos internacionais. A exportação de serviços digitais se torna importante estratégia de geração de valor econômico. O ecossistema de inovação tecnológica brasileiro se consolida como protagonista no cenário internacional.,0,Economia
Startups de impacto social: modelos de negócios que combinam lucro e transformação social,"As startups de impacto social representam uma nova fronteira do empreendedorismo brasileiro. Esses modelos de negócio integram geração de lucro com soluções para desafios sociais e ambientais. Áreas como educação, saúde, inclusão financeira e sustentabilidade são principais focos dessas iniciativas. Investidores internacionais e fundos de impacto social reconhecem o potencial dessas empresas. A inovação social se torna estratégia fundamental para o desenvolvimento econômico inclusivo e sustentável.",0,Economia
Desenvolvimento de ecossistemas de inovação em regiões metropolitanas,"As regiões metropolitanas brasileiras estão se transformando em centros dinâmicos de inovação e empreendedorismo. Parques tecnológicos, incubadoras e universidades criam ambientes colaborativos que estimulam o desenvolvimento de startups e empresas inovadoras. Cidades como São Paulo, Campinas e Belo Horizonte lideram esse movimento de integração entre academia, governo e setor privado. Esses ecossistemas potencializam a transferência de conhecimento e a criação de soluções tecnológicas disruptivas. A concentração de talentos e recursos em regiões metropolitanas acelera o processo de inovação nacional.",0,Economia
Economia criativa no artesanato e cultura regional,"O artesanato e a cultura regional se configuram como importantes vetores da economia criativa brasileira. Comunidades locais transformam tradições culturais em oportunidades econômicas, valorizando saberes tradicionais e gerando renda. Plataformas digitais e políticas de valorização cultural ampliam o alcance de produtos artesanais para mercados nacionais e internacionais. A economia criativa no artesanato representa não apenas uma estratégia econômica, mas um mecanismo de preservação cultural. Designers e empreendedores ressignificam elementos culturais tradicionais em produtos de alto valor agregado.",0,Economia
Economia de baixo carbono: investimentos em tecnologias sustentáveis,"A economia de baixo carbono emerge como estratégia fundamental para o desenvolvimento sustentável brasileiro. Investimentos em tecnologias limpas, como energias renováveis, agricultura de baixo impacto e processos industriais eficientes, ganham protagonismo. Empresas e governos buscam reduzir emissões e criar modelos econômicos mais sustentáveis. O Brasil possui vantagens competitivas únicas para liderar essa transição, com sua matriz energética limpa e biodiversidade. A economia de baixo carbono representa uma oportunidade de inovação, atração de investimentos e competitividade global.",0,Economia
Estratégias econômicas para preservação da Amazônia,"A preservação da Amazônia se torna estratégia econômica fundamental para o desenvolvimento sustentável brasileiro. Modelos de negócio baseados na bioeconomia valorizam a floresta em pé, criando alternativas econômicas para comunidades locais. Investimentos em tecnologias de monitoramento, pagamento por serviços ambientais e cadeias produtivas sustentáveis ganham relevância. A floresta amazônica é reconhecida como ativo estratégico global para mitigação das mudanças climáticas. Empresas e governos buscam integrar conservação ambiental com desenvolvimento econômico.",0,Economia
Investimentos em infraestrutura logística e seu impacto no desenvolvimento econômico,"A infraestrutura logística brasileira se configura como elemento crucial para a competitividade econômica nacional. Investimentos em modernização de portos, rodovias, ferrovias e sistemas de transporte multimodal reduzem custos e aumentam a eficiência produtiva. O desenvolvimento logístico permite melhor integração de cadeias produtivas e acesso a mercados globais. Regiões como Centro-Oeste e Norte ganham destaque com projetos de infraestrutura que democratizam o desenvolvimento econômico. A logística moderna se torna elemento estratégico para a inserção competitiva do Brasil no cenário internacional.",0,Economia
A agricultura brasileira continua sendo um pilar fundamental da economia,"O agronegócio brasileiro consolida sua posição como motor econômico nacional, com destaque para culturas como soja, café e cana-de-açúcar. Tecnologias de agricultura de precisão e inovações em biotecnologia aumentam a produtividade e sustentabilidade do setor. O Brasil se mantém como um dos principais produtores e exportadores agrícolas mundiais, utilizando tecnologia de ponta e práticas sustentáveis. A diversidade agrícola nacional permite adaptabilidade e resiliência econômica. O setor gera empregos, divisas e impulsiona o desenvolvimento de tecnologias inovadoras.",0,Economia
A indústria automobilística brasileira mantém sua relevância,"A indústria automobilística brasileira continua sendo estratégica, com plantas de grandes montadoras multinacionais renovando seus investimentos. Processos de eletrificação, desenvolvimento de veículos autônomos e tecnologias de baixa emissão transformam o setor. Regiões como ABC Paulista e interior de São Paulo mantêm-se como polos de produção e inovação automotiva. A indústria não apenas produz veículos, mas desenvolve tecnologias que impactam toda a cadeia produtiva nacional. Investimentos em pesquisa e desenvolvimento mantêm o Brasil competitivo no mercado global automotivo.",0,Economia
As políticas fiscais recentes têm buscado equilibrar o crescimento econômico,"As políticas fiscais brasileiras recentes adotam estratégias complexas para equilibrar crescimento econômico e geração de empregos. Medidas de estímulo à formalização, redução de impostos para setores estratégicos e políticas de desenvolvimento setorial ganham destaque. O governo busca criar ambiente favorável para investimentos, especialmente em setores mais vulneráveis. A flexibilização de regras e o incentivo à inovação são elementos centrais dessas políticas. O equilíbrio entre responsabilidade fiscal e estímulo econômico torna-se fundamental para a recuperação e desenvolvimento nacional.",0,Economia
As startups brasileiras estão revolucionando setores estratégicos,"Startups brasileiras lideram processos de transformação em setores como fintech, agritech e healthtech, atraindo investimentos internacionais significativos. Ecossistemas de inovação em grandes centros urbanos potencializam o desenvolvimento de soluções tecnológicas disruptivas. Empreendedores brasileiros demonstram criatividade ao desenvolver produtos que respondem a desafios locais e globais. O volume de investimentos em startups cresce exponencialmente, sinalizando maturidade do ecossistema empreendedor nacional. Essas empresas não apenas inovam, mas redesenham modelos de negócio tradicionais.",0,Economia
Bioeconomia da Amazônia: estratégias econômicas sustentáveis,"A bioeconomia amazônica emerge como modelo inovador de desenvolvimento econômico sustentável. Comunidades tradicionais e cientistas desenvolvem estratégias baseadas na biodiversidade local, criando cadeias produtivas de alto valor agregado. Produtos como cosméticos, fármacos e alimentos especiais são desenvolvidos a partir de recursos florestais. O conhecimento tradicional se integra à tecnologia moderna, gerando modelo econômico único. A bioeconomia representa alternativa de desenvolvimento que valoriza a conservação ambiental e a inclusão social.",0,Economia
Clusters de inovação tecnológica em cidades como Campinas e São José dos Campos,"Os clusters de inovação tecnológica em Campinas e São José dos Campos representam ecossistemas estratégicos para o desenvolvimento econômico brasileiro. Concentrações de empresas de alta tecnologia, centros de pesquisa e universidades criam ambientes de colaboração e inovação. Essas regiões atraem investimentos nacionais e internacionais, especialmente nos setores aeroespacial, de tecnologia da informação e biotecnologia. A sinergia entre academia, indústria e governo potencializa o desenvolvimento de soluções tecnológicas de ponta. Esses clusters se tornam referência internacional em produção de conhecimento e inovação.",0,Economia
Comércio internacional de produtos orgânicos e certificados,"O mercado internacional de produtos orgânicos brasileiros experimenta crescimento exponencial, destacando a qualidade e sustentabilidade da produção nacional. Certificações rigorosas e práticas agrícolas sustentáveis agregam valor aos produtos brasileiros nos mercados globais. Pequenos e médios produtores encontram novas oportunidades de exportação através de produtos orgânicos diferenciados. A diversidade agrícola brasileira permite o desenvolvimento de uma ampla gama de produtos orgânicos de alta qualidade. O comércio internacional de orgânicos se torna estratégia fundamental para a agricultura brasileira.",0,Economia
Cooperativas de economia solidária no semiárido nordestino,"As cooperativas de economia solidária no semiárido nordestino se configuram como modelo de resistência econômica e desenvolvimento local. Comunidades organizadas desenvolvem estratégias colaborativas de produção, comercialização e distribuição de recursos. Práticas de economia solidária promovem inclusão social, geração de renda e fortalecimento de comunidades tradicionais. Agricultura familiar, artesanato e produção de alimentos são principais vetores dessas iniciativas. O modelo cooperativo representa alternativa de desenvolvimento econômico sustentável para regiões historicamente marginalizadas.",0,Economia
Economia circular: startups brasileiras desenvolvendo soluções inovadoras,"Startups brasileiras lideram processos de inovação em economia circular, desenvolvendo soluções para reciclagem e sustentabilidade. Modelos de negócio baseados na reutilização, reaproveitamento e transformação de resíduos ganham protagonismo. Empresas desenvolvem tecnologias que convertem resíduos industriais e urbanos em novos produtos e processos produtivos. A economia circular representa estratégia fundamental para redução de impactos ambientais e criação de novos modelos econômicos. Inovação e sustentabilidade se integram como vetores de desenvolvimento empresarial.",0,Economia
"Economia criativa no Brasil: setores de design, música, jogos digitais e arte","Os setores de economia criativa brasileira ganham relevância internacional, com destaque para design, música, jogos digitais e arte. Profissionais brasileiros conquistam mercados globais através de criatividade, inovação e qualidade. Plataformas digitais ampliam o alcance de produções culturais e criativas nacionais. O Brasil desenvolve ecossistemas de economia criativa que integram tecnologia, cultura e empreendedorismo. A diversidade cultural brasileira se torna diferencial competitivo na produção de conteúdo criativo.",0,Economia
Economia digital e plataformas de marketplace,"As plataformas de marketplace revolucionam a economia digital brasileira, conectando pequenos produtores a mercados globais. Tecnologias digitais eliminam barreiras tradicionais de comércio, permitindo que microempreendedores alcancem consumidores em diferentes regiões. Sistemas de pagamento digital, logística integrada e estratégias de marketing digital potencializam as vendas online. A economia de plataforma democratiza o acesso a mercados e gera novas oportunidades de negócio. Pequenos produtores encontram canais de comercialização antes indisponíveis.",0,Economia
O investimento em startups tem crescido exponencialmente,"O ecossistema de investimento em startups brasileiras experimenta crescimento acelerado, com concentração em polos como São Paulo, Florianópolis e Belo Horizonte. Fundos de investimento nacionais e internacionais reconhecem o potencial de inovação das empresas brasileiras. Setores como fintech, healthtech e agritech atraem maior volume de investimentos. A maturidade do ecossistema empreendedor brasileiro se consolida através de investimentos cada vez mais sofisticados. Startups brasileiras desenvolvem soluções inovadoras que respondem a desafios locais e globais.",0,Economia
O mercado de criptomoedas e blockchain cresce rapidamente,"O mercado brasileiro de criptomoedas e blockchain se desenvolve de forma dinâmica, atraindo investidores e empreendedores tecnológicos. Regulamentações mais claras e infraestrutura tecnológica robusta impulsionam o crescimento do setor. Startups desenvolvem soluções inovadoras em finanças descentralizadas, contratos inteligentes e tokenização de ativos. O Brasil se posiciona como importante centro de inovação em tecnologias financeiras digitais. A democratização do acesso a investimentos e serviços financeiros se torna possível através dessas tecnologias.",0,Economia
O mercado de minério de ferro brasileiro continua sendo estratégico,"O mercado de minério de ferro mantém posição fundamental na economia brasileira, com exportações que contribuem significativamente para o PIB nacional. Empresas como Vale lideram processos de modernização e sustentabilidade na extração mineral. Investimentos em tecnologias de mineração de baixo impacto ambiental ganham relevância estratégica. O Brasil se mantém como um dos principais produtores mundiais de minério de ferro. A cadeia produtiva mineral representa importante vetor de desenvolvimento econômico e geração de divisas.",0,Economia
O setor de serviços representa mais de 70% do PIB brasileiro,"O setor de serviços consolida sua posição como principal motor da economia brasileira, representando mais de 70% do PIB nacional. Áreas como tecnologia, educação, saúde e serviços financeiros lideram esse crescimento. A transformação digital amplia as possibilidades de prestação de serviços, criando novos modelos de negócio. Profissionais brasileiros desenvolvem soluções inovadoras que respondem a demandas complexas do mercado global. A diversificação econômica representa estratégia fundamental para resiliência econômica nacional.",0,Economia
O turismo de negócios em cidades como São Paulo movimenta significativamente a economia nacional,"O turismo de negócios em metrópoles brasileiras, especialmente São Paulo, configura-se como importante vetor econômico de geração de valor e dinamização de setores produtivos. Centros de convenções, hotéis corporativos e infraestrutura de eventos profissionais atraem investidores e empresários de diferentes setores econômicos. A capacidade de atração de eventos internacionais posiciona o Brasil como destino estratégico para negócios globais. Setores como hotelaria, serviços de alimentação e transportes são diretamente beneficiados por essa modalidade de turismo. A movimentação econômica gerada ultrapassa bilhões de reais anualmente.",0,Economia
Pequenas e médias empresas são o motor da economia brasileira,"As pequenas e médias empresas (PMEs) representam a espinha dorsal do tecido econômico brasileiro, gerando mais de 50% dos empregos formais no país. Ecossistemas de apoio, como linhas de crédito especiais, programas de capacitação e ambientes de inovação, fortalecem o desenvolvimento desses empreendimentos. A digitalização e as plataformas online permitem que PMEs alcancem mercados antes inacessíveis. Setores como serviços, comércio e indústria de transformação são principais campos de atuação dessas empresas. A resiliência e adaptabilidade das PMEs são fundamentais para o desenvolvimento econômico local.",0,Economia
Potencial econômico da energia renovável,"O Brasil possui imenso potencial econômico em energia renovável, com destaque para eólica, solar e biomassa. Investimentos em infraestrutura de geração limpa atraem capital internacional e posicionam o país como líder mundial em matrizes energéticas sustentáveis. Regiões como Nordeste brasileiro se tornam polos globais de geração de energia eólica e solar. A transição energética representa não apenas uma estratégia ambiental, mas uma oportunidade de desenvolvimento tecnológico e geração de empregos. A diversificação da matriz energética aumenta a segurança e competitividade econômica nacional.",0,Economia
Desenvolvimento de ecossistemas de inovação em universidades brasileiras,"As universidades brasileiras se transformam em centros dinâmicos de geração de inovação e empreendedorismo. Programas de transferência tecnológica, incubadoras de startups e parcerias com o setor privado ampliam o impacto econômico das instituições de ensino superior. Núcleos de pesquisa desenvolvem soluções para desafios empresariais e sociais. A integração entre academia, governo e mercado potencializa a criação de tecnologias disruptivas. Universidades se tornam protagonistas no desenvolvimento de capital humano qualificado e inovação aplicada.",0,Economia
Economia circular na construção civil,"A economia circular na construção civil representa revolução nos modelos tradicionais de produção e gestão de resíduos. Tecnologias de reciclagem, reutilização de materiais e processos sustentáveis ganham protagonismo no setor. Empresas investem em métodos construtivos que reduzem desperdícios e impactos ambientais. A construção civil passa a integrar princípios de sustentabilidade como estratégia competitiva. Inovações tecnológicas permitem o desenvolvimento de materiais e processos mais eficientes e sustentáveis.",0,Economia
Economia criativa em comunidades periféricas,"Comunidades periféricas brasileiras desenvolvem ecossistemas de economia criativa como estratégia de transformação social e geração de renda. Cultura, arte, tecnologia e empreendedorismo se integram para criar novos modelos econômicos. Jovens empreendedores desenvolvem soluções inovadoras que respondem a desafios locais. Políticas públicas e iniciativas privadas fortalecem esses ecossistemas de economia criativa. A periferia se torna protagonista de processos de inovação e desenvolvimento econômico.",0,Economia
Economia da cultura,"A economia da cultura se consolida como importante vetor de desenvolvimento econômico, com festivais, eventos e produções artísticas gerando significativo impacto financeiro. Setores como música, audiovisual, artes cênicas e patrimônio cultural movimentam bilhões de reais anualmente. Políticas de fomento e incentivo cultural ampliam o alcance e a profissionalização do setor. A cultura brasileira se torna ativo estratégico de geração de valor econômico e soft power internacional. Criatividade e diversidade cultural se transformam em recursos econômicos.",0,Economia
Economia dos dados,"A economia dos dados emerge como novo paradigma de geração de valor econômico, com empresas brasileiras desenvolvendo estratégias de monetização e análise de informações. Inteligência artificial, machine learning e big data se tornam ferramentas fundamentais para tomada de decisões estratégicas. Startups especializadas em análise de dados ganham protagonismo em diferentes setores econômicos. A transformação digital permite a criação de novos modelos de negócio baseados em inteligência de dados. Privacidade e segurança da informação se tornam elementos centrais nessa economia.",0,Economia
